### ISSUE TITLE
fnv1a_ch sticking metric to the same port

### ISSUE THREAD

**Issue by MichaelMayorov** [grobian/carbon-c-relay#326]
Hi!

Consider 2013, 2023, 2033 and 2043 are carbon-cache ports. Let's see following tcpdmp

```
root@vm41814:~# tcpdump -A -nn -i any port 2013 or port 2023 or port 2033 or port 2043 -r shit.pcap | egrep '(IP|gauge-1-osdop_w_in_bytes)' | grep collectd.node02.ceph.gauge-1-osdop_w_in_bytes -B1
reading from file shit.pcap, link-type LINUX_SLL (Linux cooked)
17:40:46.969877 IP 192.168.10.240.59940 > 192.168.11.142.2013: Flags [.], seq 7359:8807, ack 1, win 229, options [nop,nop,TS val 2104846689 ecr 299980439], length 1448
collectd.node02.ceph.gauge-1-osdop_w_in_bytes 346919423 1516804846
--
17:40:59.752371 IP 192.168.10.240.59940 > 192.168.11.142.2013: Flags [.], seq 28834:30282, ack 1, win 229, options [nop,nop,TS val 2104849884 ecr 299983852], length 1448
collectd.node02.ceph.gauge-1-osdop_w_in_bytes 346919423 1516804859
--
17:41:12.974225 IP 192.168.10.240.59940 > 192.168.11.142.2013: Flags [.], seq 55094:56542, ack 1, win 229, options [nop,nop,TS val 2104853190 ecr 299986609], length 1448
collectd.node02.ceph.gauge-1-osdop_w_in_bytes 346919423 1516804872
--
17:41:25.991052 IP 192.168.10.240.60400 > 192.168.11.142.2013: Flags [.], seq 622:2070, ack 1, win 229, options [nop,nop,TS val 2104856444 ecr 299990450], length 1448
collectd.node02.ceph.gauge-1-osdop_w_in_bytes 346919423 1516804885
--
17:41:29.769431 IP 192.168.10.240.60400 > 192.168.11.142.2013: Flags [P.], seq 9470:9537, ack 1, win 229, options [nop,nop,TS val 2104857389 ecr 299991313], length 67
}u.-....collectd.node02.ceph.gauge-1-osdop_w_in_bytes 346919423 1516804885
--
17:41:39.062908 IP 192.168.10.240.60400 > 192.168.11.142.2013: Flags [.], seq 27788:29236, ack 1, win 229, options [nop,nop,TS val 2104859712 ecr 299993807], length 1448
collectd.node02.ceph.gauge-1-osdop_w_in_bytes 346919423 1516804898
--
17:41:51.928055 IP 192.168.10.240.60614 > 192.168.11.142.2013: Flags [P.], seq 17781:18985, ack 1, win 229, options [nop,nop,TS val 2104862928 ecr 299997081], length 1204
collectd.node02.ceph.gauge-1-osdop_w_in_bytes 346919423 1516804911
```

As you can see one metric is stick on the same port for different tcp sessions from carbon-c-relay

Here is config I've used:
```
cluster send-to-any-one
    fnv1a_ch replication 1
        192.168.11.142:2013
        192.168.11.142:2023
        192.168.11.142:2033
        192.168.11.142:2043
        192.168.11.138:2013
        192.168.11.138:2023
        192.168.11.138:2033
        192.168.11.138:2043
        192.168.11.135:2013
        192.168.11.135:2023
        192.168.11.135:2033
        192.168.11.135:2043
        192.168.11.147:2013
        192.168.11.147:2023
        192.168.11.147:2033
        192.168.11.147:2043
    ;

match *
    send to send-to-any-one
    ;
```

I expected picking different ports, but somehow it didn't work out...

Could you advise what's wrong with my setup?

```
carbon-c-relay -v
carbon-c-relay v3.2 (a2feab-dirty)
```

**Comment by grobian** [comment]
c-relay sticks to the same cache instance for performance reasons of the backend caches.  Because you use `fnv1a_ch` if one backend goes offline, metrics are cached for it.  Use `any_of` cluster if you want others to take over.

**Comment by MichaelMayorov** [comment]
Oh, It seems I misunderstood docs:

> The fnv1a_ch cluster is a identical in behaviour to carbon_ch, but it uses a different hash technique (FNV1a) which is faster but more importantly defined to get by a **limitation of carbon_ch to use both host and port from the members.** This is useful when multiple targets live on the same host just separated by port.

To me it was like an option to stick metric to the host but pick different ports to avoid single carbon-cache process overloading. How can I distribute a metric across multiple instances located on specific host of cluster?

**Comment by grobian** [comment]
There is currently no way of doing a 2-stage routing in a single relay.

You would have to use two stages, the first being something like:
```
cluster hosts fnv1a_ch
  ip1
  ip2
  ip3
  ...
;
match * send to hosts;
```

then stage2 on each ipX node should look like this:
```
cluster caches any_of
  127.0.0.1:2003
  127.0.0.1:2013
  127.0.0.1:2023
  ...
;
match * send to caches;
```

**Comment by MichaelMayorov** [comment]
Thanks @grobian ! That makes a lot of sense to me. BTW, I really enjoy replacing stock carbon-relay with carbon-c-relay because it eliminates performance bottleneck in my system and allow to build a scalable and reliable monitoring infrastructure. Keep up the good work!
