### ISSUE TITLE
Incorrect hash routing when using Aggregate function.

### ISSUE THREAD

**Issue by toopa2002** [grobian/carbon-c-relay#266]
I use aggregate function as below configuration and found that the metric generated from aggregate function not send to the same end point server in cluster. Seem like it choose server by round robin, instead of hashing.

- Configuration

```
cluster alpha_open_stack
    fnv1a_ch
    10.206.150.110:2103
    10.206.150.111:2103
    10.206.150.112:2103
    10.206.150.114:2103
    10.206.150.134:2103
    10.206.150.120:2103
    10.206.150.121:2103
    10.206.150.123:2103
    10.206.150.125:2103
    10.206.150.129:2103
    10.206.150.136:2103
    10.206.150.137:2103
    ;
aggregate ^(production|pre_production|integration_testing|quality_assurance|development)\.(emea|amers|apac|global)\.([^.]*)\.([^.]*)\.([^.]*)\.([^.]*)\..*
    every 10 seconds
    expire after 90 seconds
    timestamp at end of bucket
    compute count write to
       carbon.test.relay_agg_rate1m
    send to alpha_open_stack
    ;
```

- TCPDUMP output

```
# tcpdump -i any -A -s 0 -nn port 2103|grep -B 5 "carbon.test"
..	.....
07:38:47.541938 IP 10.238.152.39.32918 > 10.206.150.121.2103: Flags [P.], seq 1:43, ack 1, win 115, options [nop,nop,TS val 2294942125 ecr 2527301255], length 42
E..^3.@.@...
..'
..y...7..;Ji'.....sD......
..	.....carbon.test.relay_agg_rate1m 2 1493883440
--
..0.Zp..
07:38:57.369927 IP 10.238.152.39.58957 > 10.206.150.120.2103: Flags [P.], seq 1:43, ack 1, win 115, options [nop,nop,TS val 2294951953 ecr 1517325516], length 42
E..^.	@.@..5
..'
..x.M.7.>.0.jP....sD......
..0.Zp..carbon.test.relay_agg_rate1m 2 1493883450
--
..W$E.M.
07:39:07.372232 IP 10.238.152.39.46796 > 10.206.150.110.2103: Flags [P.], seq 1:43, ack 1, win 115, options [nop,nop,TS val 2294961956 ecr 1158696423], length 42
E..^..@.@.:S
..'
..n...7.=.........sD......
..W$E.M.carbon.test.relay_agg_rate1m 2 1493883460

```

**Comment by pipamc** [comment]
We have meet the same question, so which version do you use?

**Comment by toopa2002** [comment]
It is 2.3.1

**Comment by wy92** [comment]
https://github.com/grobian/carbon-c-relay/blob/master/router.c#L2328 
Changing `firstspace + strlen(w->pattern)` to `firstspace` seems to solve this problem.

**Comment by grobian** [comment]
that's quite possibly correct

**Comment by toopa2002** [comment]
Thank, it solve the problem.
